index,text,label
cnc_train_03_132_0_0,"As threatened , BJP candidate P.K. Krishnadas began a fast in front of the controversial plot at Kannammoola on Thursday morning .",0
cnc_train_03_133_0_0,"By noon , veteran BJP leader O. Rajagopal took over the fast as Krishnadas had to go for campaigning .",1
cnc_train_03_134_0_0,Rajagopal concluded the fast in the evening when the Home Minister ’ s office informed BJP leaders about the report sent to the Election Commission .,1
cnc_train_03_135_0_0,The fast of BJP leaders was inaugurated by NSS Taluk Union president Sangeeth Kumar .,0
cnc_train_03_136_0_0,He said the peaceful strike demanding a memorial for Chattambi Swami will continue till the government takes a decision on the issue .,0
cnc_train_03_137_0_0,"The strike will be intensified after consulting with like-minded people , he added .",1
cnc_train_03_139_0_0,Protestors and activists of Janmasthana Samrakshana Samithy alleged that the idol was destroyed as directed by Sandhya .,0
cnc_train_03_141_0_0,The police said the two factions got engaged in the fight following a wordy duel over some poll issues .,1
cnc_train_03_143_0_0,The university has planned an increased despite the # FeesMustFall protests that caused unrest and turned violent towards the end of the year .,1
cnc_train_03_144_0_0,"Wits students held protests demanding the realisation of free , quality and decolonised education , in line with the call of the # FeesMustFall movement .",1
cnc_train_03_146_0_0,The police questioned Sanmugavel regarding the threat call to Nehru .,0
cnc_train_03_147_0_0,Four persons were arrested on Sunday in connection with making life threat calls to former minister K N Nehru .,1
cnc_train_03_148_0_0,"The caller threatened to kill the former minister , saying that Nehru would be the next target after his brother Ramajayam .",0
cnc_train_03_149_0_0,The threat came just two days after Ramajayam ’ s murder .,0
cnc_train_03_151_0_0,"‘ Unacceptable behaviour ’ While demanding the arrest of Sasikumar ’ s murderers , Mr. Karunanidhi said causing damage to public or private property in the wake of the murder was unacceptable .",0
cnc_train_03_152_0_0,"ANDHRA PRADESH Women stage dharna for gas connection October 04 , 2008 00:00 IST Staff Reporter WARANGAL : Hundreds of women under the aegis of CPI ( M ) staged a dharna at the Collectorate demanding free gas connection .",1
cnc_train_03_153_0_0,Members of several Self Help Groups ( SHGs ) reached the town sporting placards and raising slogans .,0
cnc_train_03_154_0_0,The interdict followed an incident in the morning when two security guards were chased off the Durban building site by striking workers .,1
cnc_train_03_155_0_0,"`` Our attorneys have written a letter to the union expressing our concern at the violence at the site today ( Thursday ) , '' he said .",0
cnc_train_03_156_0_0,A small group of workers were seen attempting to burn notices issued by the management which informed workers that any industrial action taken by non-NUM members was an illegal strike .,0
cnc_train_03_157_0_0,Metro police intervened and the fire was put out .,0
cnc_train_03_158_0_0,Hundreds of workers gathered at the stadium at 7.30am on Thursday continuing the second day of the NUM strike in windy and cloudy conditions .,0
cnc_train_03_159_0_0,"The strike may continue next week , '' he said .",0
cnc_train_03_160_0_0,"Even with the strike continuing , Group Five-WBHO Consortium on Wednesday gave their reassurance that construction of the stadium was on track and that delivery of the stadium was not in jeopardy .",0
cnc_train_03_161_0_0,More than a thousand workers downed tools at 7am on Wednesday after talks with management failed on Tuesday .,1
cnc_train_03_164_0_0,Law and locals in a free-for-all 19th October 2009 01:07 AM The clash between police and the local people in Palode on Sunday .,0
cnc_train_03_168_0_0,The clashes were allegedly sparked off by some local people pelting stones at the police party .,1
cnc_train_03_169_0_0,"As the violence mounted , the police hurled teargas shells and grenades at the mob .",0
cnc_train_03_170_0_0,A police jeep and several two-wheelers were damaged .,0
cnc_train_03_171_0_0,The Palode police have registered a case against about 300 persons in connection with the incident .,0
cnc_train_03_172_0_0,The trade union federation said the march by thousands of women to the Union Buildings in Pretoria in 1956 against pass books was a turning point in history .,0
cnc_train_03_173_0_0,"On this day in 1956 around 20,000 women participated in a national march to protest against pass law legislation , which required non-white South Africans to carry a document on them to prove that they were allowed to enter `` white areas '' .",1
cnc_train_03_174_0_0,Women of all races and ages from all corners of the country marched to the Union Buildings in Pretoria .,0
cnc_train_03_175_0_0,"The march was organised by the Federation of South African Women ( Fedsaw ) and led by Helen Joseph , Rahima Moosa , Sophie Williams and Lilian Ngoyi .",0
cnc_train_03_176_0_0,"Mineworkers across the North West have decided to combine their strike efforts , a workers ' representative said in Rustenburg on Saturday .",0
cnc_train_03_177_0_0,"`` We have realised the weak point of the way we are striking one by one , '' Sphamandla Makahanya said during an Anglo American Platinum ( Amplats ) strike rally at the Olympia Park Stadium .",0
cnc_train_03_178_0_0,More than a thousand striking workers were gathered at a mass rally .,0
cnc_train_03_179_0_0,The crowd was singing and dancing as police in Nyalas and vans kept watch over proceedings .,0
cnc_train_03_180_0_0,`` The strike is still on . '',0
cnc_train_03_181_0_0,"They had been on a wildcat strike since September 12 , demanding to be paid a minimum of R16,000 a month .",1
cnc_train_03_184_0_0,Efforts to persuade the farmers to relent failed to yield result and the irate farmers continued their protest till late in the evening .,1
cnc_train_03_185_0_0,"The strike at Anglo American Platinum ( Amplats ) in Rustenburg will continue , the Rustenburg strike co-ordinating committee said on Monday .",0
cnc_train_03_186_0_0,`` The strike is on .,0
cnc_train_03_187_0_0,Amplats said it had offered to reinstate all workers on the same terms and conditions of employment as applied before their illegal strike .,0
cnc_train_03_189_0_0,Workers who did not participate in the strike would receive a once-off loyalty allowance of R2000 .,0
cnc_train_03_190_0_0,"Amplats workers went on strike on September 12 , demanding a monthly salary of R16,000 .",1
cnc_train_03_191_0_0,"`` Prolonged strikes may lead to the company closing down , '' he said after a Congress of SA Trade Unions rally in Rustenburg .",1
cnc_train_03_192_0_0,"|PTI GAYA : A 20 - year-old youth was shot dead allegedly by JD(U) MLC Manorama Devi 's son Rocky for overtaking his vehicle near police line in Bihar 's Gaya district , triggering protests in the area .",1
cnc_train_03_196_0_0,"Chief Minister Y.S. Rajasekhara Reddy , sought details of the exchange of fire in Karimnagar yesterday , in which a student was killed in police firing .",0
cnc_train_03_197_0_0,"Meanwhile , in an isolated incident , the Naxalites blew up a telephone exchange in Perur village in Devarakadra mandal in Mahaboobnagar district in the early hours today .",0
cnc_train_03_198_0_0,"The move was seen as highly controversial and sparked about 13,000 to take to the streets in a protest that ended in clashes with police .",1
cnc_train_03_199_0_0,"In a separate and extremely rare protest , more than 2,000 members of the legal profession marched against Beijing ’ s meddling in the local legal system .",1
cnc_train_03_201_0_0,"Following this , hundreds of farmers from different parts of the district , under the leadership of Melkote MLA K.S. Puttannaiah , staged a protest near the KRS entrance on Thursday evening .",0
cnc_train_03_203_0_0,The march started from the Martyrs ' Column at Palayam and concluded before the Secretariat .,0
cnc_train_03_204_0_0,The participants raised slogans demanding stern action to check atrocities against women in the name of moral policing .,1
cnc_train_03_205_0_0,K.G. Suraj presided over the protest meeting .,0
cnc_train_03_207_0_0,"China ’ s president Xi Jinping , who had been in the former British colony on a three-day tour , flew out of Hong Kong just hours before the annual protest kicked off in Victoria Park on Saturday afternoon .",0
cnc_train_03_208_0_0,"“ We know he has gone back to Beijing but we still want to show that they can not ignore our voice , ” said Howard Cheng , 28 , one of the leaders of the group that organises the rally , the Civil Human Rights Front ( CHRF ) .",0
cnc_train_03_210_0_0,"Saturday ’ s rally , which will be followed by a massive pro-Beijing firework display celebrating the anniversary , kicked off at about 3.30pm local time .",0
cnc_train_03_211_0_0,"A column of protestors surged westwards from the park towards Hong Kong ’ s financial centre , carrying flags , banners and yellow umbrellas – the symbol of 2014 ’ s mass protests – stamped with the words : “ Power to the people ” .",0
cnc_train_03_212_0_0,"Many demonstrators carried messages of dissent on black and white T-shirts emblazoned with slogans such as : “ Never back down ” , “ fight for Hong Kong , ” and , more poetically , “ being born in uncertain times carries certain responsibilities ” .",0
cnc_train_03_213_0_0,"We are here to tell the world that , ” Nathan Law , a local pro-democracy legislator who was among those leading the rally , told the Guardian .",0
cnc_train_03_214_0_0,"Eddie Chu , a 39-year-old environmentalist and pro-democracy politician , said the rally was “ the most important chance to show the power of the people ” .",0
cnc_train_03_215_0_0,"This is what we need. ” Jason Leung a 16-year-old protestor , was marching with a poster carrying a rather different message .",0
cnc_train_03_217_0_0,Hong Kong is not China. ” Xi Jinping was hundreds of kilometres away by the time Saturday ’ s protest began but he left demonstrators a clear message before his departure .,0
cnc_train_03_218_0_0,He said in an address before the protests began that Hong Kong must not be used as a launchpad to challenge Beijing ’ s authority and any questioning of China ’ s sovereignty in the territory “ crosses a red line ” .,0
cnc_train_03_222_0_0,"The parades come after two separate eruptions of bloodletting claimed more than a dozen lives in Xinjiang , a sprawling border region which has been blighted by repeated outbreaks of ethnic violence and terrorist attacks .",0
cnc_train_03_223_0_0,Last Tuesday three machete-wielding attackers were reported to have been gunned down by police after they killed five civilians in Hotan ’ s Pishan county .,1
cnc_train_03_224_0_0,On 28 December four assailants were reportedly shot dead after using home-made explosives to launch a deadly assault on a government compound in Karakax county .,1
cnc_train_03_226_0_0,“ Chen has gone in the opposite direction with these military parades which are quite remarkable really … We saw similar-type events after the 2009 riots but here we are talking about in response to what was really a small knife attack in Hotan .,0
cnc_train_03_228_0_0,"Those incidents included a street bombing in Urumqi , a knife attack on civilians at a train station in Kunming , and a car-bomb attack in Beijing ’ s Tiananmen Square .",0
cnc_train_03_229_0_0,"However , until the recent killings a period of relative calm appeared to have descended on the region .",0
cnc_train_03_231_0_0,The developments at the prestigious engineering institute also triggered politicking even as the state government assured that safety will be ensured for the students hailing from other states at the campus where CRPF has been deployed to instill a sense of security .,0
cnc_train_03_232_0_0,"A day after lathicharge by local police on the agitating non-local students at the campus , the Union HRD Ministry rushed a three-member team -- Sanjeev Sharma , Director ( Technical Education ) in the ministry , Deputy Director Finance Fazal Mehmood and Chairman of Board of Governors of NIT M JZarabi -- here this morning .",0
cnc_train_03_233_0_0,The students said the police had taken away national flag from them during a clash on Friday last and demanded that it be returned to them .,0
cnc_train_03_234_0_0,"The students , who had assembled in a hall inside the NIT campus , also demanded strict action against police personnel including Deputy Superintendent of Police who resorted to lathicharge on them yesterday .",0
cnc_train_03_235_0_0,"We also demand the DySP change his statement in which he has said that students hurled stones at police , "" said a student , who was speaking on behalf of the rest .",0
cnc_train_03_236_0_0,""" My officers are in touch with the agitating students and their family members .",0
cnc_train_03_238_0_0,""" I only want to say that CM of J & K has assured that no injustice will be done , "" Irani said , adding Mehbooba has assured her that an enquiry has been ordered into the clashes inside the the NIT campus .",0
cnc_train_03_239_0_0,"Home Minister Rajnath Singh , campaigning in West Bengal for assembly polls , said he had spoken to Mehbooba who gave an assurance that all students are safe and she would enquire how the incident happened and fix responsibility .",0
cnc_train_03_242_0_0,They waved placards with slogans such as `` Justice must be done '' and `` Stop killing our mothers '' .,0
cnc_train_03_244_0_0,It found that the police were not suitably equipped to quell public disorder during the protest and had failed to devise a plan to regulate and monitor the protest .,0
cnc_train_03_245_0_0,It also found that the police failed to authorise a suitably qualified and experienced member to represent them at consultations or negotiations during the protest .,0
cnc_train_03_247_0_0,"The issue was raised by Dalit activist Thol Thirumavalavan , the Lok Sabha MP who heads the Viduthalai Chiruthaigal Katchi of Tamil Nadu , where protests were staged over the row .",0
cnc_train_03_249_0_0,"Staging a protest at Bhajanpura , BJP Delhi unit chief Vijay Goel said Chief Minister Arvind Kejriwal has failed to check power tariff hikes .",0
cnc_train_03_250_0_0,"As the information was spread in the area , the public started gathering in front of the check-post demanding the arrest of the policeman .",1
cnc_train_03_251_0_0,"Referring to the Muzaffarnagar riots , he said the Akhilesh Yadav-led SP Government in the state had provided unprecedented relief measures to the riot victims , while the victims of the communal carnage in the other states had been left to fend for themselves .",0
cnc_train_03_252_0_0,"As for the SP Government ’ s failure to prevent the flare-up , Mulayam conceded that the preventive measures could have defused the situation .",0
cnc_train_03_253_0_0,"However , he pointed out that the orgy of violence had been brought under control within 48 hours .",0
cnc_train_03_254_0_0,"Moreover , he said the Akhilesh Government ought to be complimented for ensuring that the state had not witnessed anymore incidents of communal violence since the Muzaffarnagar carnage .",0
cnc_train_03_256_0_0,The dharna was organised by several Muslim women 's organisations at the behest of AIDWA and Bhartiya Muslim Mahila Andolan ( BMMA ) .,0
cnc_train_03_257_0_0,"like Delhi , Agra , Bijnor , Kanpur and Bhopal attended it .",0
cnc_train_03_258_0_0,There was also largescale displacement in Kandhamal district during and after the 2008 riots following the killing of Swami Lakshmanananda Saraswati .,1
cnc_train_03_259_0_0,"On Tuesday , National People 's Congress Chairman Zhang Dejiang said the central government firmly supported Leung and his government , the first such remark since this year 's July 1 rally .",0
cnc_train_03_261_0_0,"`` The SA Police Service had to clear the barricaded roads and had to force open the voting stations where the locks were changed by the communities in Bamboo Spruit , Jozana 's Nek , and Mngcunubeni in Sterkspruit , '' Mraji said in a statement .",0
cnc_train_03_262_0_0,"Voters were intimidated at the Kiba voting station , and there were protests in Engcobo , which police dispersed .",0
cnc_train_03_263_0_0,"Agitation to be intensified 02nd April 2011 12:35 AM ALUVA : The ongoing agitation against the closure of study centres in the name of reformist leaders in Sree Sankaracharya Sanskrit University in Kalady will be intensified , said the office-bearers of the Confederation of Sanathana Dharma Suhruth Vedi here on Friday .",0
cnc_train_03_265_0_0,"The Suhruth Vedi activists were on a war path demonstrating various forms of peaceful agitations in Kalady , Angamaly , Thiruvananthapuram , etc. However , the agitation will be intensified by forming action committees in Aluva , Perumbavoor , Chalakudy , Manjapra , Thuravoor and Malayattoor , said SNDP Aluva Union Secretary K N Divakaran .",0
cnc_train_03_267_0_0,"Not only were the 41 illegally taking part in the strike , as they were essential service workers , but they were also preventing fellow employees from working , by threatening and physically attacking them .",0
cnc_train_03_268_0_0,They were also preventing the public from entering the premises of health facilities .,0
cnc_train_03_270_0_0,"Most government and private establishments remained open in Vijayawada city , one of the nerve centres of the agitation against the bifurcation .",0
cnc_train_03_271_0_0,"But educational institutions , some of whom have declared holiday , remained closed entirely .",0
cnc_train_03_272_0_0,"TDP legislator Devineni Umamaheswara Rao , former MP Gadde Ramamohan and city unit president B Venkanna alongwith other protesters staged demonstration at the bus station , stalling district bus services for about two hours .",0
cnc_train_03_273_0_0,"Workers of TDP , YSRCP and pro-united Andhra Pradesh groups organised protests across the Seemandhra .",0
cnc_train_03_274_0_0,"YSR Congress Party , which initially had called for a day-long bandh , extended it today .",0
cnc_train_03_275_0_0,Police took into custody fifteen activists for blocking the traffic in Visakhapatnam .,1
cnc_train_03_276_0_0,TDP leaders blocked the roads at various places in the Krishna district .,0
cnc_train_03_277_0_0,"LeT militant held for beheading Congress leader 21st May 2011 12:04 PM JAMMU : A Lashkar-e-Taiba ( LeT ) terrorist has been arrested for the murder of Congress leader Abdul Gani Rather last week , police said Saturday .",1
cnc_train_03_278_0_0,The Congress leader was kidnapped and beheaded by Lashkar terrorists on the night of May 16 .,0
cnc_train_03_281_0_0,"R. Subathra Devi , sub judge , presided over the human chain near the Government Arts College for Women .",0
cnc_train_03_282_0_0,"Professors , students of the college , NGO volunteers , Government employees and women from all walks of life participated in the programme .",0
cnc_train_03_283_0_0,The participants carried placards with messages on violence against women .,0
cnc_train_03_284_0_0,"Earlier , the Social Welfare Organisation for Rural Development ( SWORD ) , an NGO based in Krishnagiri , staged street corner plays on violence against women and also evils of child marriages in about 20 villages in the district , said Mr. V.S.S. Jalaludeen , Secretary .",0
cnc_train_03_285_0_0,State Convener of ‘ Campaign against Negligence of Girl Child ’ M. Shankar was the special invitee for the programme .,0
cnc_train_03_286_0_0,"' This not only smacks of arrogance but also of some element of frustration . "" Sonia Gandhi at an election rally in Karnataka 's Bidar Wednesday had described Advani a "" slave of the Rashtriya Swayamsevak Sangh ( RSS ) "" .",0
cnc_train_03_287_0_0,""" The attack by the Maoists today is a pointer to the real situation of internal security , "" Jaitley said , and added that the Congress government had failed to address the social and economic concerns of the Maoists .",0
cnc_train_03_290_0_0,"Dr Joshi said , “ The protest was to make the government realise the hazards of allowing stone crushers to function in an agriculturally rich area .",1
cnc_train_03_291_0_0,The incident triggered outrage across the country and was condemned as despicable and shameful stirring memories of a similar attack last December in New Delhi that sparked nationwide protests .,1
cnc_train_03_296_0_0,They blocked the Gulbarga - Aland Road from 11 a.m. to 6.30 p.m. causing inconvenience to the public .,1
cnc_train_03_297_0_0,Mr. Patil and others insisted that Deputy Commissioner Pankaj Kumar Pandey arrive at the scene of protest to receive the memorandum from them .,1
cnc_train_03_298_0_0,"The strike by casual workers at mail processing centres in some parts of Gauteng has ended , the SA Post Office ( SAPO ) said on Friday .",0
cnc_train_03_299_0_0,"`` Mail that had already been on the service pipeline is now delayed by 48 hours , but the speedy resolution of the strike more than compensates for this service backlog . ''",0
cnc_train_03_300_0_0,"On Monday , casual workers in certain areas in Gauteng went on strike .",0
cnc_train_03_301_0_0,"`` This was part of their lobbying campaign to be appointed into permanent part-time positions , '' SAPO said at the time .",0
cnc_train_03_302_0_0,Retail outlets had not been affected by the strike .,0
cnc_train_03_303_0_0,"He enrolled at UNISA after his expulsion from the University of the North ( Turfloop ) for political activism , which arose from the organisation of the pro-Frelimo rallies in 1974 under the banner of the then South African Students Organisation ( SASO ) .",0
cnc_train_03_305_0_0,"They have failed the African National Congress and they shame us as the alliance , '' he told members of the SA Municipal Workers' Union ( Samwu ) at a protest march in Durban .",0
cnc_train_03_306_0_0,"Marchers carried placards reading : `` We demand decent salary with omnibus '' , and `` We demand stability at the metro police . ''",0
cnc_train_03_307_0_0,They reacted angrily when mayor James Nxumalo was not available to accept their memorandum .,1
cnc_train_03_308_0_0,It was accepted instead by his adviser Joe Nene .,0
cnc_train_03_310_0_0,"TRS men attack Renuka 's office 02nd December 2009 10:54 AM HYDERABAD : Telangana Rashtra Samiti ( TRS ) activists Wednesday set ablaze Congress party leader and former union minister Renuka Chowdhry 's office in Khammam town , about 200 km from here .",0
cnc_train_03_311_0_0,"The door and windows of the office were damaged when TRS workers torched the office after throwing petrol on it , police said .",1
cnc_train_03_312_0_0,A group of TRS workers fled after setting the office on fire .,0
cnc_train_03_314_0_0,Tension gripped Khammam as KCR continued his ' fast unto death ' in a government-run hospital in Khammam demanding a separate Telangana .,1
cnc_train_03_315_0_0,"KCR , who was arrested Sunday and sent to judicial custody for 14 days ahead of his ' fast unto death ' , launched the hunger strike in Khammam sub-jail .",1
cnc_train_03_317_0_0,"When the chief minister was about to inaugurate the mela in the afternoon , some candidates made a dash towards the dais , shouting : “ CM down , down ’ ’ and “ Government down , down ’ ’ .",0
cnc_train_03_318_0_0,"It was just a handful of aspirants who raised slogans but the police chased us out of the stadium beating us mercilessly , ’ ’ complained J Srinivas , an unemployed youth who attended the mela .",0
cnc_train_03_322_0_0,And the students seem to be in no mood to skip them citing the agitation as they have realised that they are crucial to complete the course .,0
cnc_train_03_323_0_0,"“ Our students are smart enough to understand that exams are crucial and they ca n't boycott them every time , ” says B. Laxmaiah , OSD to Vice-Chancellor and who has dealt with students carefully at the peak of agitation as Dean of Students ' Welfare .",0
cnc_train_03_324_0_0,"But with the agitation in full swing and disturbances on the campus , they were further postponed .",1
cnc_train_04_0_0_0,"Eventually , students of the campus and constituent colleges boycotted the exams while affiliated college students wrote the exams but in lesser numbers .",0
cnc_train_04_1_0_0,"The poor response could be gauged from the fact that out of 21,773 candidates only 3,391 appeared and the boycott was total in campus colleges .",0
cnc_train_04_4_0_0,"“ In fact , a majority of the students were in favour of keeping the agitation and exams on different platforms .",0
cnc_train_04_5_0_0,"But the surcharged emotions after the release of Srikrishna Committee report made us to boycott exams , ” a student leader agreed .",1
cnc_train_04_6_0_0,Students declare that they cannot continue agitation as they have to concentrate on exams,1
cnc_train_04_7_0_0,"Students clash with police in Osmania university - Indian Express Agencies , Agencies : Hyderabad , Mon Feb 15 2010 , 14:34 hrs Over 10 security personnel and few media persons were injured on Monday in a fresh clash between students and security men in Osmania University in Hyderabad , the nerve-centre of separate Telangana agitation .",0
cnc_train_04_8_0_0,"Students in large numbers gathered in the campus today and hurled stones at the security personnel , including state police and personnel of Central paramilitary force , DCP ( East Zone ) Mahesh Chandra Ladda said .",0
cnc_train_04_9_0_0,"The stone pelting resulted in injuries to about 12 security personnel , he said .",1
cnc_train_04_10_0_0,"No student suffered injuries in the incident , Ladda said .",0
