index,text,label
cnc_train_01_1_0_0,"Chale was allegedly chased by a group of about 30 people and was hacked to death with pangas , axes and spears .",0
cnc_train_01_2_0_0,His attackers allegedly drank his blood .,0
cnc_train_01_3_0_0,"Tip asked Mathunjwa why he had not `` explicitly '' told armed , striking mineworkers to leave the hill where they had gathered and return to work .",0
cnc_train_01_4_0_0,`` It the protest was something which happened outside the labour structures .,0
cnc_train_01_7_0_0,Lt-Col Andre Traut said the teenager laid the complaint at the Robertson police station following a farmworkers ' protest in the area .,1
cnc_train_01_8_0_0,Table grape harvesters started protesting about their working conditions in De Doorns last month .,0
cnc_train_01_9_0_0,The protests spread to 15 other towns and resulted in two deaths and the destruction of property .,1
cnc_train_01_10_0_0,The farmworkers ' strike resumed on Tuesday when their demands were not met .,1
cnc_train_01_12_0_0,It was in January this year a group of persons attacked the NHAI office at Kalamassery and distributed notices supporting armed revolt against the government .,0
cnc_train_01_13_0_0,Both Anoop and Ramanan are also accused in the case related to attack on the Nitta Gelatin office at Panampilly Nagar last year .,0
cnc_train_01_14_0_0,VS condemns attack on NSS Karayogams 08th May 2011 05:00 AM THIRUVANANTHAPURAM : Chief Minister V S Achuthanandan has condemned the recent attacks on NSS Karayogams .,0
cnc_train_01_15_0_0,"When asked about the series of attacks on Karayogams , he said that such attacks could not be entertained .",0
cnc_train_01_17_0_0,The attack on Karayogams had sparked sharp reactions from the CPM leaders .,1
cnc_train_01_18_0_0,`` I am going to argue your evidence that strikers at Marikana in August 2012 attacked the police should be kicked out .,0
cnc_train_01_19_0_0,"Mpofu said Lt-Col Kaizer Modiba was fabricating his evidence about the violence during the mineworkers ' strike at Marikana , near Rustenburg in the North West , because he had not been in a position to witness an attack .",1
cnc_train_01_20_0_0,"`` I observed the attack on the police , I have no doubt about it , '' Modiba said during cross-examination .",1
cnc_train_01_21_0_0,He said he was about 100 metres away when he witnessed the attack .,0
cnc_train_01_22_0_0,"Modiba said he saw the aggressive strikers running alongside a police Nyala , charging at police .",0
cnc_train_01_23_0_0,"The commission , chaired by retired Judge Ian Farlam , is investigating the deaths of 44 people during the wage-related strike at Lonmin 's platinum mining operations at Marikana in August 2012 .",0
cnc_train_01_24_0_0,"On August 16 , 2012 , 34 people , mostly mineworkers , were shot dead in a clash with police who were trying to disarm and disperse them .",1
cnc_train_01_25_0_0,"Sonia Gandhi was speaking at a function after flagging off 12 new trains , along with Railway Minister Mamata Banerjee , through videoconferencing at Kanpur railway station .",0
cnc_train_01_26_0_0,"Claiming that the dozen new trains would prove to be a boon for UP , Sonia said later at a public rally organised adjacent to the railway station that it was after a long gap that the Railway ministry had done so much in one go for the state .",0
cnc_train_01_27_0_0,"The function was organised by Kanpur Congress Lok Sabha member and Union Coal Minister Shriprakash Jaiswal , and attended by ministers of state for railway , E. The new trains are Kanpur-New Delhi Shatabdi Express , Lucknow - New Delhi Duronto , Allahabad - New Delhi Duronto , Gorakhpur - Lokmanya Tilak Terminal Express , Varanasi-Jammu Tawi Superfast , Lucknow-Yashwantpur Express , Agra-Lucknow Intercity , Mathura-Kasganj Passenger , Bhopal - Pratapgarh Express , Gorakhpur - Nainital Express , Gorakhpur - Noutha Passenger and Chapra - Mathura Express .",0
cnc_train_01_30_0_0,The lorry owners ’ association was staging a protest by blocking the road near Ambedkar Circle .,1
cnc_train_01_31_0_0,"Barring this incident , the agitation by other organisations on Thursday was peaceful .",0
cnc_train_01_33_0_0,"On Tuesday Clegg sent a series of supportive tweets , including : “ I sympathise a great deal with the brave pro-democracy demonstrators taking to the streets of Hong Kong. ” He said the UK remained committed to the joint declaration and said that “ universal suffrage must mean real choice ” for voters and “ a proper stake in the 2017 election ” .",0
cnc_train_01_34_0_0,"The demonstrations pose a real problem , not just for the British but for others too .",0
cnc_train_01_36_0_0,Ms. Surekha ’ s absence at the recently held protest meeting by Y .,0
cnc_train_01_37_0_0,"Hindu outfits blocked by police 04th November 2009 04:48 AM THIRUVANANTHAPURAM : Protests against foreign missionary Bernard Blessing ’ s presence in the city spilled into the streets on Tuesday evening with Hindu organisations taking out a march to his prayer meeting , and engaging in a minor scuffle with the police .",0
cnc_train_01_38_0_0,"A protest march jointly organised by the Vishwa Hindu Parishad and Hindu Aikya Vedi entered into a scuffle with the police near the State Central Library even as Blessing led , his supporters claimed , ` ` a packed prayer meeting ’ ’ at the Chandrasekharan Nair Stadium .",0
cnc_train_01_39_0_0,The protest march started at 7.30 p.m. but the police blocked it before it reached the venue .,0
cnc_train_01_43_0_0,"Protesting the unethical ban , hundreds of Bengal traders launched an agitation on Monday and threatened to intensify it , if the matter is not resolved soon .",1
cnc_train_01_44_0_0,"The neighbouring State apparently relented after 500 trucks carrying vegetables , eggs , fishes and other perishable items from Andhra Pradesh were detained by BJD activists at various places in Balasore .",1
cnc_train_01_45_0_0,"“ Though after the CM-level talks , we released all the detained trucks to West Bengal , they took back all the potato-laden trucks to their State , ” Agrawal said .",0
cnc_train_01_46_0_0,Labour Minister Mildred Oliphant intervened on Monday in an extended strike by petrol attendants and workers in the automotive industry .,0
cnc_train_01_47_0_0,"The strike began on September 9 , with Numsa demanding a double-digit percentage increase .",1
cnc_train_01_48_0_0,"About 70,000 workers were reported to be on strike .",0
cnc_train_01_49_0_0,"Protests show rising green concerns PUBLISHED : Wednesday , 04 July , 2012 , 12:00am Mass protests this week over the planned construction of a molybdenum-copper alloy plant in Shifang , Sichuan province show that environmental concerns are becoming a leading cause of social unrest .",0
cnc_train_01_52_0_0,"Last summer , tens of thousands of people in the northeastern city of Dalian , Liaoning , marched to demand the relocation of a chemical plant .",1
cnc_train_01_54_0_0,"Following the Xiamen incident , the ' not in my backyard ' mentality sparked similar protests in several mainland cities , including Dalian , Guangzhou and Shantou .",1
cnc_train_01_55_0_0,Analysts say the mainland public has taken to such protests because they lack adequate channels to express their concerns about environmental risks posed by massive industrial projects .,1
cnc_train_01_57_0_0,"SRINAGAR : One killed , 100 injured in Valley September 01 , 2016 00:00 IST As curfew was lifted from all 10 districts , violence singed the Kashmir Valley on Wednesday , leaving a civilian dead and over 100 injured .",1
cnc_train_01_59_0_0,Divisional Commissioner ( Kashmir ) Baseer Khan said more than 900 people attacked an Army convoy at Ladoora Rafiabad in Baramulla district .,0
cnc_train_01_60_0_0,"“ Amid stone-throwing , some rounds were fired at the convoy going to Kupwara .",0
cnc_train_01_61_0_0,"But the locals said clashes between the residents and the Army started in the morning when the latter stopped the movement of fruit trucks in Rafiabad and Sopore , asking the drivers to ply only during the shutdown period .",1
cnc_train_01_62_0_0,"“ The youth was killed at a protest against the Army ’ s action halting the vehicles , ” alleged Mohammad Yasin Khan , head of a traders ’ body .",0
cnc_train_01_63_0_0,"Joshua Wong , the teenage activist who was one of the most recognisable faces of Hong Kong ’ s umbrella movement protests , has been found guilty of “ illegal assembly ” by a court in the former British colony .",0
cnc_train_01_64_0_0,The action helped launch a 79-day street occupation that was described as the greatest challenge to China ’ s Communist rulers since the 1989 Tiananmen protests .,1
cnc_train_01_66_0_0,"Meanwhile , a peace rally , taken out on behalf of the Sarvodaya movement from Chennai , reached Kamarajar district .",0
cnc_train_01_67_0_0,ANDHRA PRADESH Constable and SI allege harassment by higher-up SEEKING JUSTICE : Reserve constable Sanyasi Sahu staging a dharna opposite the City Armed Reserve office in Visakhapatnam on Saturday .,0
cnc_train_01_68_0_0,"April 09 , 2006 00:00 IST Senior officers reportedly trying to sort out issue VISAKHAPATNAM : The Police Stadium , which also houses the headquarters of the City Armed Reserve located , witnessed a rare incident of a constable and a Sub-Inspector staging a silent protest .",0
cnc_train_01_69_0_0,"Incidentally , the officer against whom they made the allegations resumed duty on Saturday after recovering from the injuries he had suffered in the police-fishermen clashes in Gangavaram on March 27 .",0
cnc_train_01_70_0_0,Some police personnel intervened and urged them to give up their protest - but to no avail .,1
cnc_train_01_71_0_0,They poured out their woes to the reporters and photographers who reached the Police Stadium on hearing about the incident .,1
cnc_train_01_73_0_0,"Madhi was produced before the ' Kangaroo Court ' and killed by the ultra for acting as a police informer , villagers alleged .",1
cnc_train_01_74_0_0,"On Friday , the Maoists had looted the house of a special police officer ( SPO ) , Lacha Madkami , one of Madhi 's relations , of the same village .",0
cnc_train_01_75_0_0,"Superintendent of police , Malkangiri , Akhileswar Singh said they have got the information about the incident and inquiry was continuing .",0
cnc_train_01_77_0_0,"However , there was hardly any affect noticed in Koraput district due to the bandh , the sources said .",0
cnc_train_01_78_0_0,"Hassan : Residents protest delay in improving road September 25 , 2013 00:00 IST Residents of Belur on Monday protested the delay in repairing the main road in the town by planting banana saplings in the middle of the road .",1
cnc_train_01_79_0_0,The protesters planted the saplings in potholes to draw the attention of the officials to the poor condition of the road .,1
cnc_train_01_80_0_0,"Earlier , the protesters , led by workers of Jaya Karnataka Vedike , took out a procession and stopped the movement of vehicles for half an hour .",1
cnc_train_01_82_0_0,KSRTC buses were attacked at ten places .,0
cnc_train_01_83_0_0,Two bus drivers were hurt in the attacks .,1
cnc_train_01_84_0_0,Hartal supporters pelted stones at a KSRTC bus at Karamana injuring driver Babu .,1
cnc_train_01_85_0_0,"In a similar incident at Karakkamandapam , KSRTC driver V .",0
cnc_train_01_86_0_0,Hartal supporters surrounded a police station at Attakkulangara demanding that four men arrested by police for pelting stones at KSRTC buses be freed .,1
cnc_train_01_87_0_0,KSRTC buses were also attacked at a few other places including Poojappura and Balaramapuram .,0
cnc_train_01_88_0_0,"At Kallukkodu , Muttathara , hartal supporters got a taste of their own medicine .",0
cnc_train_01_89_0_0,"However , local people and the shopkeepers joined forces and pelted stones at the hartal supporters forcing them to flee .",1
cnc_train_01_92_0_0,"Although everyone is keenly aware of how the power of the internet helped foster the massive march in 2003 , for now there are hotter topics in local cyberspace .",0
cnc_train_01_93_0_0,"Management , Unions at loggerheads in KSRTC over attack on employees 07th July 2012 11:27 AM 204 attacks in 120 days !",0
cnc_train_01_94_0_0,The controversy sparked off after the Kerala State Road Transport Employees Association ( KSRTEA ) pasted stickers on KSRTC buses seeking public intervention against ‘ police-goonda ’ attack on employees .,1
cnc_train_01_95_0_0,The management responded to this by issuing an order the other day seeking immediate removal of the posters .,0
cnc_train_01_96_0_0,"‘ ’ They did nothing when the staff were brutally attacked by anti-social elements and police officials , ’ ’ said Jose Jacob , general secretary of the KSRTEA .",0
cnc_train_01_99_0_0,"Sivaji Terminus in Mumbai firing indiscriminately with an AK -47 on 26/11 , while a brave constable tried to return fire with a .303 rifle is still green .",0
cnc_train_01_102_0_0,"Max Chung , who delivered the application for a letter of no objection from the police , that is required to hold a rally , said : “ We want to show to the public and international community that Hong Kongers , we will never surrender in front of terrorism … To show our solidarity and say no to terrorism , we have to stand up. ” Chung said : “ Yuen Long was under terrorist attack and we have no choice but to take it back. ” The protests , principally over a controversial bill that would allow suspects to be extradited from Hong Kong to mainland China , have taken on new demands , including an investigation into police use of rubber bullets , teargas and physical violence against protesters .",0
cnc_train_01_103_0_0,Protesters are angry at the police ’ s slow response to the attack in Yuen Long and their pursuit of the case .,1
cnc_train_01_104_0_0,The violence in Yuen Long has heightened tensions and fears of further attacks .,1
cnc_train_01_105_0_0,"On Tuesday evening , unverified footage showed men in white gathering in Tuen Mun , another city near Yuen Long in the New Territories .",0
cnc_train_01_106_0_0,"Hong Kong ’ s leader , Carrie Lam , said the “ shocking violence ” in Yuen Long would be investigated , but devoted most of her comments to criticising protesters , who surrounded Beijing ’ s liaison office in Hong Kong and defaced the national emblem of the People ’ s Republic of China on Sunday .",0
cnc_train_01_107_0_0,"On Tuesday , a group of aviation staff called for a protest at Hong Kong airport on Friday to condemn the government and police for “ ignoring the random attacks on citizens in Yuen Long ” .",1
cnc_train_01_108_0_0,"In Yuen Long , Chung and other protesters are demanding the government conducts an independent investigation and officially characterises the violence as a “ cross-border terrorist attack ” .",0
cnc_train_01_110_0_0,"Suddenly , a motley group of slogan-shouting students emerged from the dhaba .",0
cnc_train_01_111_0_0,"They exhorted us to join the protest against the recommendations of the Mandal Commission , which had been implemented a day earlier .",0
cnc_train_01_112_0_0,Thus we too joined the sloganeering .,0
cnc_train_01_113_0_0,"By the time the self-styled leaders had commandeered a few DTC buses , nearly 200 postgraduate and doctoral students had gathered at an intersection , which later became the epicentre of protests and was rechristened euphemistically as Kranti Chowk .",0
cnc_train_01_114_0_0,"Some hotheads tried to gatecrash , provoking the policemen into action  they charged ferociously , dispersing the crowd within minutes .",1
cnc_train_01_115_0_0,"That night , Doordarshan telecast news of protests .",0
cnc_train_01_117_0_0,"As we closed in on the hideout of the militants , a fire fight began that continued for over an hour , ” he said .",0
cnc_train_01_118_0_0,"According to reports , two militants have been shot dead in the encounter .",0
cnc_train_01_119_0_0,"“ One of them is Amir Ali Kamal , code name Akram , who was prime accused in the Delhi High Court blast , ” the officer said .",0
cnc_train_01_120_0_0,Akram was on the radar of the National Investigation Agency ( NIA ) as he is believed to have arranged explosives and planter for the blast .,1
cnc_train_01_121_0_0,"He is an accused in the Delhi High Court blast of Sep 7 , 2011 in which at least 10 people were killed and over 70 injured .",1
cnc_train_01_122_0_0,The NIA wanted to catch Akram alive as he could provide clues in resolving the blast case .,1
cnc_train_01_123_0_0,The Kishtwar area has been in focus ever since the Delhi High Court blast as the first of the e—mails claiming responsibility for the blast emanated from here .,0
cnc_train_01_124_0_0,Two more youths were arrested later for allegedly being involved in the blast .,1
cnc_train_01_125_0_0,Modi visited the homes of all the six victims of the serial blasts which rocked Patna ’ s Gandhi Maidan and other parts of the city during his visit to address the Hunkar Rally on October 27 .,0
cnc_train_01_127_0_0,"Now , he is charged with exploiting the grief of the terror victims of 26/10 .",0
cnc_train_01_128_0_0,"By visiting the families of the Patna blast victims , NaMo is drilling home the point that NiKu is least bothered about the personal tragedies of his people .",0
cnc_train_01_129_0_0,"In August that year , militantly aggressive Kurmis mowed down 14 Dalits in the sleepy hamlet of Belchchi in Nalanda district .",0
cnc_train_01_130_0_0,"Indira landed in Nalanda and waded into the floodwaters on an elephant to visit each Dalit family , which had lost members in the caste pogrom .",1
cnc_train_01_131_0_0,The grief list also includes the nights spent by Rahul in Dalit colonies and the visits of Manmohan Singh and Sonia Gandhi to Chhattisgarh after top Congress leaders were massacred by Naxalites .,0
cnc_train_01_132_0_0,Modiites are now reminding the Congress about the trips which Sonia and the Prime Minister made to Muzzafarnagar after 43 were killed in the worst-ever communal clashes in decades .,0
cnc_train_01_133_0_0,Bandhopadhay also said two Trinamool Congress workers were killed at Sashan in North 24 Parganas district recently .,0
cnc_train_01_134_0_0,"A car with Union ministers Mukul Roy and Sultan Ahmed was attacked allegedly by CPM cadres on Wednesday , he alleged .",0
cnc_train_01_137_0_0,"US Committed to Seeking Justice on Behalf of All 26/11 Victims 05th August 2015 12:04 PM NEW YORK : The US is committed to pursuing justice on behalf of the victims of the 2008 Mumbai attack no matter how "" arduous "" the task is , a top Indian-origin American diplomat has said .",0
cnc_train_01_138_0_0,""" We have certainly reiterated our support and our commitment to India 's efforts to seek justice on behalf of the victims "" of the 26/11 attack , Assistant Secretary of State for South and Central Asian Affairs Nisha Desai Biswal told PTI when asked about the delay in bringing to justice the perpetrators of the 2008 terror attacks .",0
cnc_train_01_140_0_0,"Given that nearly seven years have passed since the horrendous terror attacks that claimed over 160 lives and injured many others , Biswal said bringing justice for the victims in terror attacks may appear to be an arduous andlong-drawn process .",0
cnc_train_01_141_0_0,Biswal underlined that the US on its part had offered rewards for information leading to the arrest and prosecution of individuals associated with the Mumbai attack .,0
cnc_train_01_142_0_0,"Referring to the terror attack in Punjab 's Gurdaspur district on July 27 , Biswal said the US has strongly condemned and expressed its concern over the attack .",0
cnc_train_01_143_0_0,She said the US has expressed its cooperation ith Indian authorities on on any specific aspects of the incident .,0
cnc_train_01_146_0_0,"The step came after RLD workers , led by district party president Ajit Rathi , former UP minister Dharamvir Balyan and MLC Chaudhry Mushtaq , staged a dharna outside the DM 's office here yesterday and submitted a memorandum to him .",0
cnc_train_01_147_0_0,"CHENNAI : Chennai sees its first ever hunger fast against HCL April 08 , 2013 00:00 IST For the first time in Chennai , graduates denied jobs by a multi-national corporation who had recruited them from their college campuses , staged a hunger strike on Sunday .",0
cnc_train_01_149_0_0,"The recruits , at Valluvar Kottam shouted slogans including , “ HCL lend us your ears , give us back our two years , ” while undertaking the day-long fast .",0
cnc_train_01_151_0_0,The naib sarpanch was killed and 17 others were seriously injured in the clash over use of a village field .,1
cnc_train_01_152_0_0,Bimbola village turned into a battle field as rival groups wielding guns took the centre stage .,1
cnc_train_01_153_0_0,The clash took place over use of the field .,1
cnc_train_01_154_0_0,Police said he was detained by group of 30 to 40 persons from the general caste on Monday morning but he managed to escape .,0
cnc_train_01_155_0_0,"However , when he was returning home in the night , Pradhan was intercepted again by them and killed .",0
cnc_train_01_156_0_0,Soon a clash ensued between supporters of Pradhan and the rival group in which 17 persons were injured .,0
cnc_train_01_159_0_0,"Patigul Tohti , who was wounded and captured at the scene , was jailed for life after being convicted of taking part in the attack .",1
cnc_train_01_160_0_0,Tohtunyaz helped them to acquire more than 10 knives used in the attack .,0
cnc_train_01_161_0_0,"Two days before the attack , local police arrested Tohtunyaz , Ehet and Muhammad as they tried to illegally cross into Vietnam via Honghe county , the court said .",1
cnc_train_01_162_0_0,"They did not confess to the planned attack after their capture , and so should bear full responsibility for the loss of life , the court said .",1
cnc_train_01_163_0_0,"Despite losing contact with the three men , five other members of the group went ahead with the attack .",0
cnc_train_01_164_0_0,"Initial reports by a variety of media , some quoting witnesses , said eight people brandished knives in the Saturday , March 1 attack .",0
cnc_train_01_165_0_0,"Police announced on the Monday after the attack that three suspects had been taken into custody , which now appears to be a reference to the trio detained on February 27 .",0
cnc_train_01_166_0_0,"At least five more people will be tried over the attack , Xinhua has reported .",0
cnc_train_01_167_0_0,The government has blamed separatist forces from Xinjiang for the attack .,1
cnc_train_01_172_0_0,Some schools which had to postpone their mid-term examinations due to the bandh have the additional task of conducting the tests before resuming the classes .,1
cnc_train_01_176_0_0,"Foreign Secretary Shivshankar Menon , who discussed bilateral issues with his Pakistani counterpart Salman Bashir on the sidelines of the SAARC Foreign Secretaries meeting here , said that Islamabad would have to bring the perpetrators of the Mumbai attack to justice and give credible evidence of dismantling the terrorist infrastructure on the soil of Pakistan .",0
cnc_train_01_177_0_0,About 125 bus operators across Gauteng stopped reporting for duty two weeks ago following a dispute in mileage payment .,1
cnc_train_01_178_0_0,"Over 60,000 pupils were left stranded by the strike .",1
cnc_train_01_180_0_0,"Four days ago , guard Rakesh Jha had gone on a hunger strike at Churchgate Station after he was denied leave despite applying two months back .",1
cnc_train_01_181_0_0,"A guard said , "" When Jha did not get leave till four hours before departure of his train , he hanged a poster around his neck announcing an indefinite hunger strike .",1
cnc_train_01_182_0_0,All the 417 guards in the suburban section refused to work extra hours in protest .,1
cnc_train_01_183_0_0,"The Left have been wiped out , "" Gandhi said at a rally here .",0
cnc_train_01_184_0_0,""" There is anarchy everywhere , misrule is all pervasive and there is a conspiracy of corruption , "" she told the gathering of about 30,000 people .",0
cnc_train_01_185_0_0,"She did not directly name Bhatta-Parsaul , the twin villages that have emerged as the epicentre of the agitation against land acquisition by the Uttar Pradesh government for an expressway project , but specifically mentioned the atrocities on farmers .",0
cnc_train_01_189_0_0,"After family members narrated the incident to their neighbours , people came on the road and held demonstrations .",1
cnc_train_01_190_0_0,"Tiruvannamalai : Cab drivers , owners take out rally May 22 , 2012 00:00 IST Tourist cab drivers and owners took out a rally here on Monday demanding to scrap lifetime tax system introduced by Tamil Nadu government .",1
cnc_train_01_191_0_0,The rally started from Kamaraj statue and proceeded through important roads of the town before culminating in front of Revenue Divisional Office .,0
cnc_train_01_192_0_0,"Tiruvannamalai District Tourist Car , Van Dirvers-Owners Welfare Association that organised the rally insisted that old tax system should continue .",0
cnc_train_01_193_0_0,At the end of the rally they submitted a memorandum to Revenue Divisional Officer V. Bupathi .,0
cnc_train_01_196_0_0,TMC workers have been accused of leading the attacks .,0
cnc_train_01_197_0_0,"There were reports of skirmishes and clashes , including stone pelting , in the area in which two policemen were injured .",1
cnc_train_01_198_0_0,"Another Congress worker , Repon Sheikh , was killed at Bharatpur in the same district during a clash between rival party supporters , the police said .",1
cnc_train_01_199_0_0,"Speaking to a TV news channel , Chief Minister Mamata Banerjee shrugged off the allegations that Trinamool cadres were behind the killing of the Congress workers .",0
cnc_train_01_200_0_0,"Accusing the CPM of instigating the violence , she said the deaths were result of clashes between the Congress and the Marxists .",1
