index,text,label
cnc_train_07_118_0_0,"On January 23 , Amcu members at Lonmin , Amplats , and Implats downed tools , demanding a monthly basic salary of R12,500 .",1
cnc_train_07_119_0_0,Amcu announced on Monday that the platinum strike was officially over and it would sign wage agreements with the platinum producers .,0
cnc_train_07_121_0_0,"In a scathing attack on the PMK at a press meet , Thirumavalavan , said the violence was not spontaneous .",0
cnc_train_07_122_0_0,"“ It was a planned attack instigated by the PMK , who are trying to gain political mileage , ” he charged and added that members of a community in 30 villages , spread across political parties , joined the PMK-led assault .",1
cnc_train_07_123_0_0,"Narrating the sequence of events before the clash , he said properties of the Dalits were plundered systematically .",0
cnc_train_07_124_0_0,This was to thwart economic well-being of the population .,1
cnc_train_07_125_0_0,They blocked access to the villages by cutting down trees .,1
cnc_train_07_126_0_0,"This was to ensure that neither the police nor the media entered these villages , ” he said .",1
cnc_train_07_127_0_0,The real reason for the violence was an attempt to derive political mileage by raking up caste emotions .,1
cnc_train_07_128_0_0,"' Did Indian Mission Facilitate Vaidik-Saeed Meet ' 15th July 2014 12:03 PM NEW DELHI : Describing journalist Ved Pratap Vaidik as an "" RSS man "" , Rahul Gandhi today questioned whether the Indian High Commission in Islamabad had facilitated the meeting between him and Mumbai attack mastermind Hafiz Saeed .",0
cnc_train_07_129_0_0,"Protesters threw stones at motorists on the R114 , between Malibongwe and Cedar roads , on Monday morning , Johannesburg metro police said .",0
cnc_train_07_130_0_0,"He said some 200 protesters became violent , and traffic had to be diverted .",1
cnc_train_07_131_0_0,The roads were first closed at 4:45am after protesters blockaded them with burning tyres .,1
cnc_train_07_132_0_0,It was not immediately known what the protest was about .,0
cnc_train_07_134_0_0,Three more alleged terrorists were shot last month after reportedly setting upon civilians with machetes .,1
cnc_train_07_135_0_0,North West premier Thandi Modise on Sunday condemned the burning of a tribal office and a municipal councillor 's house in Khunotswane village outside Zeerust .,0
cnc_train_07_136_0_0,`` Our disappointment is that the violence occurred after attempts earlier in the day by my office to receive a memorandum from the community . '',1
cnc_train_07_137_0_0,North West police said a group of people gathered next to the Bahurutshe Ba-Ga Moiloa tribal office on Friday evening burning tyres and singing struggle songs .,0
cnc_train_07_138_0_0,"`` The group split themselves in two to execute attack at around 8pm , '' Brigadier Thulane Ngubane said .",1
cnc_train_07_139_0_0,`` Some of the people burned the tribal office while the other proceeded to the councillor 's yard and burned the two-roomed house and broke windows of her newly built house . '',0
cnc_train_07_140_0_0,"When police arrived some people started throwing stones at them , said Ngubane .",0
cnc_train_07_141_0_0,"The Cecelia Makiwane Hospital in East London was again the scene of anger and protest on Tuesday , following the death of four babies at the hospital last week , the SABC reported .",0
cnc_train_07_142_0_0,About 200 members of the Treatment Action Campaign ( TAC ) protested outside the hospital and like the families they want answers .,1
cnc_train_07_143_0_0,They said they would continue with the action until a concrete plan was in place .,1
cnc_train_07_145_0_0,Chanting ' Abolish the levy .,0
cnc_train_07_146_0_0,"Wage increase now ' in English and Chinese , the group marched from Chater Road to the Central Government Offices .",0
cnc_train_07_147_0_0,Hundreds of domestic helpers who were resting under the HSBC building cheered loudly as protesters passed through .,0
cnc_train_07_149_0_0,"Protest heldAs a part of the on-going nation-wide agitation , the employees of the insurance companies held a demonstration in front of the regional office of the National Insurance Company Limited in Sector 35 here .",0
cnc_train_07_152_0_0,"Friday was the concluding day of Rahul ’ s three-day tour of Amethi where he launched several important projects , addressed party workers , met members of women ’ s self-help groups and held a public meeting , besides reviewing various development works .",0
cnc_train_07_153_0_0,"Earlier in Amethi , around 2,000 people attended a ‘ janata darbar ’ ( people ’ s court ) held by Rahul wherein he patiently listened to public grievances , said state Congress spokesperson Akhilesh Pratap Singh .",0
cnc_train_07_154_0_0,"’ 93 blasts : SC to deliver verdict today 21st March 2013 07:54 AM Twenty years and a week after the serial blasts rocked Mumbai on March 12 , 1993 , the Supreme Court will be delivering its judgment in the case on Thursday .",0
cnc_train_07_155_0_0,"The coordinated attacks on a Friday , are said to be the most destructive bomb explosions in Indian history .",0
cnc_train_07_156_0_0,The attacks resulted in over 250 deaths and injuries to more than 700 people .,1
cnc_train_07_157_0_0,Main accused Dawood Ibrahim Kaskar and Tiger Memon have still not been brought to trial as they fled India hours after the blasts .,1
cnc_train_07_159_0_0,"Sainath Metri , taluk panchayat member ; Pandurang , Yeshwant Datekar , Mahadev Kumtekar and Narayan Govekar , leaders of fishermen who led the agitation , told presspersons that the officials would forget the development of road after the inauguration of the bridge .",0
cnc_train_07_161_0_0,The striking VRAs called on Kavitha at Telangana Bhavan here on Thursday and poured out their grievances before her .,0
cnc_train_07_162_0_0,"In a related development at Salem in Tamil Nadu , a 26 year-old man attempted self-immolation protesting against Rajapaksa ' visit .",1
cnc_train_07_165_0_0,We are excited to announce that our protest action on Tuesday has resulted in a great victory for learners at Sizimisele .,1
cnc_train_07_166_0_0,On Tuesday we went to picket at the Western Cape Provincial Legislature after we had gone over a month without teachers .,1
cnc_train_07_167_0_0,"We held two protests before Tuesday 's action , and received nothing but broken promises from the WCED .",0
cnc_train_07_168_0_0,Following our march the WCED gave us a letter saying the following would happen :,1
cnc_train_07_169_0_0,When we got up to go home the police acted violently towards us even though our protest was peaceful .,1
cnc_train_07_171_0_0,"Images of Xi holding a yellow umbrella , a symbol of the 2014 pro-democracy protests , would also be removed by police .",0
cnc_train_07_173_0_0,"In all , 30 incidents were reported from various districts and 31 Electronic Voting Machines ( EVMs ) were damaged .",0
cnc_train_07_175_0_0,"In Kadapa district , EVMs were damaged at 19 polling stations at Rayachoti , Pulivendula , Kamalapuram , Rajampet , Mydukuru and Budvel .",0
cnc_train_07_176_0_0,"In Pulivendula and Kamalapuram alone , EVMs were damaged at seven polling stations each .",0
cnc_train_07_177_0_0,Miscreants either poured water on the machines or damaged them with sticks .,0
cnc_train_07_178_0_0,"In Anantapur district , EVMs were damaged at eight polling stations while in Prakasam , the machines were damaged at six polling stations .",0
cnc_train_07_179_0_0,"EVMs were damaged at two polling stations each in Guntur and West Godavari districts , and one polling station each in Chittoor , East Godavari and Krishna districts .",0
cnc_train_07_181_0_0,Some members of the groups even hurled crude bombs but none was injured .,0
cnc_train_07_182_0_0,"There were complaints about polling agents being kidnapped in Kadapa , Anantapur and Kurnool districts which are being verified .",0
cnc_train_07_183_0_0,"At Pitchaturu village in Satyaveedu constituency of Chittoor district , a polling officer was manhandled by the polling agents and the police is verifying the case .",0
cnc_train_07_184_0_0,"Senior police officials , while referring to it as a major achievement , said there were only 30 incidents when compared to the 350 incidents during the 2004 elections .",0
cnc_train_07_185_0_0,"Moreover , there was no loss of life or injuries to any person resulting out of use of fire arms or explosives by the warring groups , police officials said .",1
cnc_train_07_186_0_0,"In all , 58 persons were arrested for indulging in violence .",1
cnc_train_07_189_0_0,"For three days , the 600 inmates at the Tahirpur Custodial Home for Leprosy Patients were on a hunger strike , they had locked up superintendent Mrityunjay Joseph and welfare officer Dharmendra Prasad , who had been transferred .",0
cnc_train_07_190_0_0,""" This has led the department to conclude that I prompted the idea of an agitation among the inmates after the two officials were transferred , ' ' he said .",1
cnc_train_07_192_0_0,Sagar denied that there was a fight between Tyagi and Prasad and added that the leprosy patients assaulted him when he went there to deliver the transfer orders .,1
cnc_train_07_193_0_0,"One day , however , he inadvertently misspoke , shouting “ Down with Mao Zedong ! ” instead .",0
cnc_train_07_194_0_0,"Within seconds he had been thrown to the ground by the “ revolutionary masses ” , and thus he began a wretched phase in life , denounced and beaten at every turn .",1
cnc_train_07_195_0_0,"In the 1980s , there was a series of student protests in China , culminating in the Tiananmen demonstrations of 1989 , when not just students but city dwellers all across the country joined the rallies .",0
cnc_train_07_196_0_0,"Back then , the demonstrations were largely motivated by concern for the fate of the nation and a desire to see democratic freedoms put in place .",1
cnc_train_07_197_0_0,"Concerned that this new policy would reduce their children ’ s chances of getting into university , they marched in the streets to protest .",1
cnc_train_07_198_0_0,"Something similar happened a few years ago in Shanghai , when retirees took to the streets , worried that if welfare funds were allocated to poor areas , their own retirement benefits would be slashed .",1
cnc_train_07_199_0_0,"﻿In recent years , for instance , many retired military veterans have gathered together across the country in protests against the stingy benefits and pensions they receive from the state .",1
cnc_train_07_201_0_0,Absolve cases against Telangana students : KCR 29th August 2010 12:36 AM HYDERABAD : TRS President K Chandrasekhar Rao today demanded that Andhra Pradesh government absolve police cases registered against the students from Telangana region during the recent separate statehood agitations .,0
cnc_train_07_203_0_0,These cases were registered against them only to restrain them from taking part in the agitation .,1
cnc_train_07_204_0_0,He was addressing a dharna organised by the Joint Action Committee ( JAC ) of various Telangana outfits demanding scrapping of cases against the students .,1
cnc_train_07_209_0_0,"Monday saw the continuing trend of protests in the city , as more than 500 people gathered at Town Hall .",1
cnc_train_07_210_0_0,"The protest was organised by the Karnataka Rajya Swayam Deva Samastegale Samiti , colleges and associations , demanding that the accused in the Delhi gang-rape case be brought to justice .",1
cnc_train_07_211_0_0,People were also protesting against the secretive manner in which the government dealt with the cremation of the girl .,1
cnc_train_07_212_0_0,"The organisers then signed a petition demanding strict legal action against the accused which would be sent to the Delhi CM , PM , and Home Minister .",1
cnc_train_07_213_0_0,Google also contributed to the protest by putting up the image of a candle on its home page .,1
cnc_train_07_214_0_0,"Wary of Sena , migrants get into a huddle MUMBAI , NOVEMBER 26 As many as 80 migrants from Bihar and Uttar Pradesh  shopkeepers to businessmen and politicians  huddled in a hastily-called meeting at Andheri on Tuesday .",0
cnc_train_07_215_0_0,"For when they had met publicly on Sunday , Shiv Sena workers had barged in violently to break up their peaceful protest .",1
cnc_train_07_216_0_0,"Since the Senas recent attack on railway recruitment candidates at Kalyan station , groups of 100 -200 migrants have been meeting at various locations , to voice their disbelief , disquiet and make plans .",1
cnc_train_07_217_0_0,"Hazare due to his ailing health was earlier forced to call off his three-day scheduled hunger strike in Mumbai Dec 28 , less than 36 hours after he began it .",1
cnc_train_07_219_0_0,"As the general strike entered the 11 { + t } { + h } day on Friday , autorickshaw driver unions also announced a two-day-long bandh till Sunday midnight .",0
cnc_train_07_220_0_0,"Muck on road after SP leader , supporters beat up LMC men - Indian Express Express News Service , Express News Service : Lucknow , Wed Jul 11 2012 , 04:20 hrs A Samajwadi Party leader and his supporters allegedly beat up three Lucknow Municipal Corporation sanitation workers and manhandled a constable in Thakurganj area on Tuesday .",0
cnc_train_07_221_0_0,The LMC workers later protested by dumping garbage on the Hardoi road and blocking traffic .,1
cnc_train_07_224_0_0,Pandey 's supporters also allegedly manhandled constable Rahul Kushwaha who had gone to control the situation .,0
cnc_train_07_225_0_0,"Angry sanitation workers then blocked traffic by dumping garbage on the Hardoi road , demanding action against Pandey .",1
cnc_train_07_226_0_0,They ended the protest after four hours when LMC Commissioner N P Singh assured that action will be taken against Pandey .,1
cnc_train_07_227_0_0,A section of students staged a protest .,0
cnc_train_07_230_0_0,"However , of the 38 counselling centres in Seemandhra region , 20 are still non functional following the protests .",0
cnc_train_07_233_0_0,Residents of Ambedkar Street and Mariamman Koil Street held a road roko on Arni Road around 8.30 am on Wednesday .,0
cnc_train_07_234_0_0,"So , instead of water being supplied at 7 am , it will be supplied at 4 pm . ” An hour later , about 100 residents held a road roko , seeking an apology and sought SI Deepa ’ s transfer .",1
cnc_train_07_236_0_0,"When asked to comment on Pakistani flags being raised in Kashmir , Thackeray said , "" Have n't seen it happen in a long time .",0
cnc_train_07_238_0_0,A student had to be administered saline drip while other 14 students refused to break their fast and end the strike until their problems were addressed .,1
cnc_train_07_239_0_0,"But Nithin would continue his hunger strike by not eating anything , he added .",1
cnc_train_07_240_0_0,The fifth year students of Integrated Pharmaceutical Chemistry ( IPC ) have been protesting since 13 days demanding division of IPC from Chemistry department .,1
cnc_train_07_242_0_0,by Jonisayi Maromo and Malegabe Motsepe Police struggled to control thousands of striking teachers ' union members at the Union Buildings in Pretoria on Wednesday .,0
cnc_train_07_243_0_0,"Protesters pushed through police barriers in an attempt to enter the buildings , but to no avail .",1
cnc_train_07_244_0_0,"Calling for the resignations of Basic Education Minister Angie Motshekga and her director general Bobby Soobrayan , protesters sang songs calling for them to `` voertsek scram '' and `` hamba go '' .",1
cnc_train_07_245_0_0,"They also wielded placards reading : `` Angie does n't know anything '' , and `` Away with declaring education an essential service '' .",0
cnc_train_07_246_0_0,One protester shouted : `` This can be another Marikana .,0
cnc_train_07_247_0_0,"While tourists visiting the Union Buildings used cameras and cellphones to photograph the protest , the vendors outside packed up their wares .",0
cnc_train_07_248_0_0,"`` The protest is out of concern by Sadtu that our education in this country needs a lot of fixing , '' said Dlamini .",0
cnc_train_07_249_0_0,Sadtu members have been on a national go-slow since pupils returned from the Easter holiday .,0
cnc_train_07_250_0_0,"The department said teachers who joined the protest march would face disciplinary action and that the no-work , no-pay rule would apply .",1
cnc_train_07_252_0_0,Violence over cut in water supply 04th December 2009 02:16 AM A boy holding an empty bucket participates along with others in a protest against water shortage in Mumbai India Thursday .,1
cnc_train_07_254_0_0,"Earlier , under the aegis of Swabhiman , hundreds of people tried to barge into the BMC headquarters near the CST .",0
cnc_train_07_255_0_0,"The recent rash of bombings in Gauteng reflected rising discontent among Afrikaners , the Afrikaner Group of 63 said on Thursday .",1
cnc_train_07_256_0_0,"`` The bombings , which have been ascribed to Afrikaners , is a clear sign of the serious alienation being experienced by Afrikaners with respect to their situation in South Africa . ''",0
cnc_train_07_257_0_0,"It condemns last week 's nine bomb blasts in Soweto , south of Johannesburg , saying acts of sabotage can not be condoned .",0
cnc_train_07_258_0_0,A woman was killed because of one of the explosions that ripped a hole in the northern wall of a mosque in Soweto 's Dhlamini area .,1
cnc_train_07_259_0_0,Other explosions cut railway lines between the sprawling township and Johannesburg .,1
cnc_train_07_260_0_0,In its letter -- released to the media -- the Group of 63 calls for the underlying causes of these actions to be examined and addressed .,0
cnc_train_07_262_0_0,"Municipal Commissioner Md. Abdul Azeem urged the employees to suspended their protest , and attend to their duties .",0
cnc_train_07_263_0_0,"Till then , cooperate . ” ‘ Assurance needed ’ The JAC convener Eswar , however , said that they cannot suspend their work to rule unless there was a categorical assurance on the salaries .",1
cnc_train_07_264_0_0,The JAC has decided to go on work to rule in any given month if the salaries were not paid on first day of that month .,1
cnc_train_07_265_0_0,The members will not keep quiet if the protest was withdrawn without any assurance .,1
cnc_train_07_267_0_0,Asked if he was apologetic about letting the strike drag on for over a week Dave said he seemed to have been extremely busy and could not be blamed .,1
cnc_train_07_268_0_0,They are not even bothering to talk to us even eight days after the strike .,0
cnc_train_07_269_0_0,And the call for strike was given over a month ago .,0
cnc_train_07_270_0_0,"In the C -6 ward meant for emergency and orthopaedic patients , three operations that were scheduled for Monday were cancelled soon after the faculty decided to intensify their agitation .",1
cnc_train_07_271_0_0,""" They are very good to us but the strike has to get over for operations to take place , ' ' said Seema whose father is awaiting an operation in ward C -6 .",1
cnc_train_07_272_0_0,"Parents and teachers held a protest demonstration in front of the school stating that the headmaster was always coming to school late , or on leave .",1
cnc_train_07_274_0_0,His letter drew attention to the recent riots in London .,0
cnc_train_07_275_0_0,"The scale of violence in Hong Kong and London simply cannot be compared , but there are perhaps some similarities for the staunchly pro-government DAB to ponder .",0
cnc_train_07_278_0_0,"Critics say the protests were partly due to hardline policies , with lamas bearing the brunt of restrictions on religious practice .",1
cnc_train_07_282_0_0,"When the Opposition members boycotted the House proceedings of the day at the end of their virulent protests and demands for the resignation of ‘ corrupt ’ Chief Minister Oommen Chandy and Excise Minister K Babu , an anxious crowd of Assembly staff and watch and ward personnel were looking at the crown of a big coconut tree , where a middle-aged person was staging a protest under the scorching sun and swaying palm fronds .",0
cnc_train_07_283_0_0,""" I do n't even recognise Ram Madhav , "" he said when asked why the RSS leader was allowed on stage during the Jantar Mantar agitation .",0
cnc_train_07_286_0_0,These aspirations were behind the series of demonstrations and rallies held last Sunday .,1
cnc_train_07_287_0_0,"In an interview published this week , and at his meetings with Beijing leaders , Financial Secretary Donald Tsang Yam-kuen sought to play down the protests .",0
cnc_train_07_289_0_0,"' What is worrying is the kind of unexpected confrontation between police and students outside the Government Headquarters this week , ' he said .",0
cnc_train_07_290_0_0,"BEST strike is off , talks to continue Posted : Fri Oct 09 1998 IST MUMBAI , October 8 : The three-day-old strike by Brihunmumbai Electric Supply and Transport undertaking has been called off .",0
cnc_train_07_292_0_0,"So what has the three-day strike which put the common man through the wringer , finally achieved ?",0
cnc_train_07_294_0_0,"The fate of an application filed by the BEST today at the industrial courts , seeking derecognition of the striking unions , hangs in balance .",1
cnc_train_07_295_0_0,No action will be taken against any agitating employee .,0
cnc_train_07_296_0_0,Anti-government protesters in Hong Kong took over key roads early on Monday amid rising tensions ahead of what expected to be a huge pro-democracy rally on the anniversary of the city ’ s handover to China .,0
cnc_train_07_299_0_0,Hundreds of protesters shouted “ retract the evil law ” in the torrential rain at one point .,0
cnc_train_07_300_0_0,"On Lung Wo Road , some protesters dug up bricks and built make-shift barricades from roadside metal railings .",0
cnc_train_07_302_0_0,"There have been large-scale protests in Hong Kong in recent years , including a two-month occupation in 2014 – but have failed to win any concessions from Beijing .",0
cnc_train_07_306_0_0,Protesters have also surrounded the police headquarters twice in past weeks in noisy and emotionally charged protests in which young people spray-painted obscenities on its front wall and barricaded its entrances .,0
cnc_train_07_309_0_0,"Eddy Chu Hoi-dick , a pro-democracy lawmaker , said while he worries about violence breaking out , he believes the young protesters in the leaderless protests have “ consensus about when they should back down ” and avoid arrest .",0
cnc_train_07_310_0_0,"On Sunday , thousands of pro-government protesters rallied outside the government headquarters in support of the city ’ s police .",1
cnc_train_07_311_0_0,"Many waved Chinese flags and hurled insults at anti-government demonstrators camped nearby , highlighting the deep ideological fissures now dividing the finance hub .",0
cnc_train_07_312_0_0,"Ramaphosa promises instant response to violence against women and children in SA Songezo Ndlendle CAPE TOWN , September 5 ( ANA ) - South Africa President Cyril Ramaphosa on Thursday addressed thousands of protesters outside Parliament following Wednesday 's mass gathering against the abuse and violence directed at women and children outside the meeting venue of the World Economic Forum in Cape Town .",0
cnc_train_07_313_0_0,The spontaneous protests come after the country has seen a number of violent crimes directed at women and children which have made headlines in recent weeks and left the country reeling .,1
cnc_train_07_314_0_0,"You have given me your memorandum and I can see all the messages on the placards that you are holding and I 'm internalising all of them , '' Ramaphosa told the protesters on Thursday .",0
cnc_train_07_315_0_0,"And some of the things that I will be announcing are set out in your memorandum , we will be responding instantly to what you have set out in your memorandum , '' Ramaphosa said .",0
cnc_train_07_318_0_0,Some in the crowd chanted `` bring death sentence back '' .,0
cnc_train_07_319_0_0,"As a nationwide commuter rail strike entered its second day on Tuesday , delaying thousands of commuters , Metrorail increased its alternative service in Cape Town to 360 bus journeys .",1
cnc_train_07_321_0_0,"5 percent wage increase for our striking staff remains on the table , '' she said .",0
cnc_train_07_322_0_0,"Earlier the Congress of South African Trade Unions ( Cosatu ) Western Cape regional secretary , Tony Ehrenreich , said the strike could be resolved for about R1 million a year .",0
cnc_train_07_323_0_0,This strike is causing huge disruptions and all because of a one percent wage increase .,1
cnc_train_08_0_0_0,"But we are managing the strike very well , '' Mlangeni said .",0
cnc_train_08_1_0_0,About 200 workers briefly protested outside the company 's head office in Johannesburg on Tuesday before agreeing to meet again on Wednesday .,0
cnc_train_08_2_0_0,"He said ‘ Operation Barricade ’ has been conducted for the first time , after the Mumbai terror attack last year .",0
cnc_train_08_4_0_0,"The blasts took place within seconds of each other around 3.30 p.m., creating panic in the area , police said .",1
cnc_train_08_5_0_0,PTI Guwahati Police Commissioner Mukesh Aggarwal said that the anti-talk faction of ULFA may be behind the attack .,1
cnc_train_08_10_0_0,The former Minister S.K. Kanta is leading the agitation .,0
cnc_train_08_11_0_0,"The organisers of the bandh , which included many Kannada organisations , Dalit organisations and heads of a few religious maths , there was no was force on the business establishments and hotels to close their establishments , and everybody 's support for the bandh call appeared voluntary .",0
cnc_train_08_12_0_0,"Though the police had assured people of full protection during the bandh , most business establishments remained closed .",1
